{
  "schemaVersion": 1,
  "kind": "engineering-process-recommendation-resolution",
  "decisionId": "remote-evidence-ordering",
  "recommendationSha256": "sha256:137a6ce0094d5bbefce305c264d4523edb392d213be91095f78517e8fed15ed7",
  "assignmentSha256": "sha256:dd4a80061fa1816e10851b996ae4055f0aaecb40ef448b190b0bc9ab42a94115",
  "reviewSha256": "sha256:a5708b8c789b81a56adb536f771593e8c80444a33759236608a1704ac9334d0d",
  "selectedOptionId": "verify-before-completion",
  "owner": {
    "ownerId": "project-owner",
    "evidenceSha256": "sha256:9999999999999999999999999999999999999999999999999999999999999999"
  },
  "selectionRationaleSha256": "sha256:aaaaaaaaaaaaaaaaaaaaaaaaaaaaaaaaaaaaaaaaaaaaaaaaaaaaaaaaaaaaaaaa",
  "controls": {
    "grantsAdoption": false,
    "grantsDeployment": false,
    "grantsLifecycleCompletion": false,
    "grantsMerge": false,
    "grantsRelease": false
  }
}
